{
  "$schema": "https://human-writing-rules.example/schemas/stability-review.schema.json",
  "target_release": "1.0.0",
  "spec_revision": "1.0.0",
  "review_revision": "stability-review-1",
  "reviewer": {
    "id": "codex.internal-stability-review",
    "type": "internal",
    "independence": "not-independent"
  },
  "dimensions": [
    {
      "id": "normative-completeness",
      "verdict": "pass",
      "evidence": [
        "RFC-0001 through RFC-0006 define scope, pipeline, objects, resolution, review, and benchmarking.",
        "conformance/requirements.json maps all 200 normative source units."
      ]
    },
    {
      "id": "normative-consistency",
      "verdict": "pass",
      "evidence": [
        "RFC dependency validation reports no unknown dependency or cycle.",
        "Conformance extraction reports no unmapped or stale normative source unit."
      ]
    },
    {
      "id": "identifier-lifecycle",
      "verdict": "pass",
      "evidence": [
        "Registry validation enforces unique active IDs, paths, dependencies, and frontmatter alignment.",
        "GOVERNANCE.md and COMPATIBILITY.md prohibit silent ID reuse in 1.x."
      ]
    },
    {
      "id": "runtime-alignment",
      "verdict": "pass",
      "evidence": [
        "All 56 registered runtime objects are active and resolve through the generated index.",
        "The starter config pins specification 1.0.0 and the generated registry source revision."
      ]
    },
    {
      "id": "reference-tooling",
      "verdict": "pass",
      "evidence": [
        "The offline reference runner, workflow, source snapshots, adapters, and guarded transitions pass the unit suite.",
        "Compatibility documentation does not present reference tooling as a fully conforming universal writing engine."
      ]
    },
    {
      "id": "reviewed-examples",
      "verdict": "pass",
      "evidence": [
        "Seventeen reviewed examples cover all 11 registered topics and all 7 platform families.",
        "High-risk examples preserve their non-advisory editorial-method boundary."
      ]
    },
    {
      "id": "benchmark-safety",
      "verdict": "pass",
      "evidence": [
        "Two benchmark cases retain controlled arms and evaluator separation.",
        "Three visual fixtures preserve auto-none, selected-asset, and hard-failure handling."
      ]
    },
    {
      "id": "public-repository-readiness",
      "verdict": "pass",
      "evidence": [
        "README, LICENSE, CHANGELOG, SECURITY, SUPPORT, GOVERNANCE, compatibility, migration, and release documentation are present.",
        "Manifest-defined release verification is offline and CI-reproducible."
      ]
    }
  ],
  "external_review": {
    "status": "not-run",
    "notes": "No independent external normative review is claimed for 1.0.0; public review remains welcome and will inform compatible 1.x clarifications or a future major revision."
  },
  "decision": "ready-for-stable-candidate",
  "limitations": [
    "This review was performed inside the project workflow and is not independent.",
    "Implementation requirements remain planned unless a concrete engine supplies the declared verification evidence.",
    "No public comparative model-quality benchmark result is part of the 1.0.0 release claim."
  ]
}
